raw,clean_text,clean_token
"A very beautiful way place to enjoy the late afternoon. Recommend taking a bike to this place if you are visiting from Phuket or central parts, the drive is beautiful. You could also follow the trail to reach the last point in the cape. It's amazing to sit there and watch the sun set at the distance. One could easily spend close to 90 minutes here.","a very beautiful way place to enjoy the late afternoon. recommend taking a bike to this place if you are visiting from phuket or central parts, the drive is beautiful. you could also follow the trail to reach the last point in the cape. it is amazing to sit there and watch the sun set at the distance. one could easily spend close to minutes here.","['a', 'very', 'beautiful', 'way', 'place', 'to', 'enjoy', 'the', 'late', 'afternoon', '.', 'recommend', 'taking', 'a', 'bike', 'to', 'this', 'place', 'if', 'you', 'are', 'visiting', 'from', 'phuket', 'or', 'central', 'parts', ',', 'the', 'drive', 'is', 'beautiful', '.', 'you', 'could', 'also', 'follow', 'the', 'trail', 'to', 'reach', 'the', 'last', 'point', 'in', 'the', 'cape', '.', 'it', 'is', 'amazing', 'to', 'sit', 'there', 'and', 'watch', 'the', 'sun', 'set', 'at', 'the', 'distance', '.', 'one', 'could', 'easily', 'spend', 'close', 'to', 'minutes', 'here', '.']"
"The atmosphere at dusk is really beautiful for watching the sun set down, especially in a cloudy day when the sun light shines across the cloud, it seems like an angel is descending from up above and the sun is moving down slowly into the horizon of the beautiful sea.","the atmosphere at dusk is really beautiful for watching the sun set down, especially in a cloudy day when the sun light shines across the cloud, it seems like an angel is descending from up above and the sun is moving down slowly into the horizon of the beautiful sea.","['the', 'atmosphere', 'at', 'dusk', 'is', 'really', 'beautiful', 'for', 'watching', 'the', 'sun', 'set', 'down', ',', 'especially', 'in', 'a', 'cloudy', 'day', 'when', 'the', 'sun', 'light', 'shines', 'across', 'the', 'cloud', ',', 'it', 'seems', 'like', 'an', 'angel', 'is', 'descending', 'from', 'up', 'above', 'and', 'the', 'sun', 'is', 'moving', 'down', 'slowly', 'into', 'the', 'horizon', 'of', 'the', 'beautiful', 'sea', '.']"
"Wow, it's definitely a spot that should not be missed in Phuket. The sunset view is superb. Try to walk to the cape as the view point is always crowded with people. We just sat at the cape to chill and wait for the sunset. But the road to the cape is a bit tough and it will be good if you wear sport shoes and not slipper.","wow, it is definitely a spot that should not be missed in phuket. the sunset view is superb. try to walk to the cape as the view point is always crowded with people. we just sat at the cape to chill and wait for the sunset. but the road to the cape is a bit tough and it will be good if you wear sport shoes and not slipper.","['wow', ',', 'it', 'is', 'definitely', 'a', 'spot', 'that', 'should', 'not', 'be', 'missed', 'in', 'phuket', '.', 'the', 'sunset', 'view', 'is', 'superb', '.', 'try', 'to', 'walk', 'to', 'the', 'cape', 'as', 'the', 'view', 'point', 'is', 'always', 'crowded', 'with', 'people', '.', 'we', 'just', 'sat', 'at', 'the', 'cape', 'to', 'chill', 'and', 'wait', 'for', 'the', 'sunset', '.', 'but', 'the', 'road', 'to', 'the', 'cape', 'is', 'a', 'bit', 'tough', 'and', 'it', 'will', 'be', 'good', 'if', 'you', 'wear', 'sport', 'shoes', 'and', 'not', 'slipper', '.']"
Great place to visit especially for the sunset but can get very busy at this time but still worth a visit,great place to visit especially for the sunset but can get very busy at this time but still worth a visit,"['great', 'place', 'to', 'visit', 'especially', 'for', 'the', 'sunset', 'but', 'can', 'get', 'very', 'busy', 'at', 'this', 'time', 'but', 'still', 'worth', 'a', 'visit']"
"A good trek down to watch the sunset. Lots of tourists stay at the top, but it is worth the hike down.","a good trek down to watch the sunset. lots of tourists stay at the top, but it is worth the hike down.","['a', 'good', 'trek', 'down', 'to', 'watch', 'the', 'sunset', '.', 'lots', 'of', 'tourists', 'stay', 'at', 'the', 'top', ',', 'but', 'it', 'is', 'worth', 'the', 'hike', 'down', '.']"
Super neat. I got there at nine in the mor ing to try and go fishing off the rocks. It is an easy hike and really beautiful. Be careful of the wind and eaves if you are not used to that type of thing. Really picturesque and stunning. I climbed all the way down and then scaled the walls to get to a private little beach on the east side. Super neat would recommend.,super neat. i got there at in the mor ing to try and go fishing off the rocks. it is an easy hike and really beautiful. be careful of the wind and eaves if you are not used to that type of thing. really picturesque and stunning. i climbed all the way down and then scaled the walls to get to a private little beach on the east side. super neat would recommend.,"['super', 'neat', '.', 'i', 'got', 'there', 'at', 'in', 'the', 'mor', 'ing', 'to', 'try', 'and', 'go', 'fishing', 'off', 'the', 'rocks', '.', 'it', 'is', 'an', 'easy', 'hike', 'and', 'really', 'beautiful', '.', 'be', 'careful', 'of', 'the', 'wind', 'and', 'eaves', 'if', 'you', 'are', 'not', 'used', 'to', 'that', 'type', 'of', 'thing', '.', 'really', 'picturesque', 'and', 'stunning', '.', 'i', 'climbed', 'all', 'the', 'way', 'down', 'and', 'then', 'scaled', 'the', 'walls', 'to', 'get', 'to', 'a', 'private', 'little', 'beach', 'on', 'the', 'east', 'side', '.', 'super', 'neat', 'would', 'recommend', '.']"
"Nice viewpoint, there also was a little trail into a place close to the ocean, not the easiest route to take, but I think all of the walking routes are not completely unfitt people friendly. Further they were partially under construction/renovation wich made some parts closed. Lots of tourists aswell so also lots off little shop.","nice viewpoint, there also was a little trail into a place close to the ocean, not the easiest route to take, but i think all of the walking routes are not completely unfitt people friendly. further they were partially under construction renovation wich made some parts closed. lots of tourists aswell so also lots off little shop.","['nice', 'viewpoint', ',', 'there', 'also', 'was', 'a', 'little', 'trail', 'into', 'a', 'place', 'close', 'to', 'the', 'ocean', ',', 'not', 'the', 'easiest', 'route', 'to', 'take', ',', 'but', 'i', 'think', 'all', 'of', 'the', 'walking', 'routes', 'are', 'not', 'completely', 'unfitt', 'people', 'friendly', '.', 'further', 'they', 'were', 'partially', 'under', 'construction', 'renovation', 'wich', 'made', 'some', 'parts', 'closed', '.', 'lots', 'of', 'tourists', 'aswell', 'so', 'also', 'lots', 'off', 'little', 'shop', '.']"
"Sunsets never gets old from wherever you see it. However, Promthep Cape will make that experience unforgettable. It's a viewpoint in Phuket overlooking the Andaman sea and is surrounded by water from three sides. You can feel the salty breeze some lone cruise on the horizon and obviously the sun, touching the line where sea and sky meet. You can never forget that experience. A must watch!","sunsets never gets old from wherever you see it. however, promthep cape will make that experience unforgettable. it is a viewpoint in phuket overlooking the andaman sea and is surrounded by water from sides. you can feel the salty breeze some lone cruise on the horizon and obviously the sun, touching the line where sea and sky meet. you can never forget that experience. a must watch","['sunsets', 'never', 'gets', 'old', 'from', 'wherever', 'you', 'see', 'it', '.', 'however', ',', 'promthep', 'cape', 'will', 'make', 'that', 'experience', 'unforgettable', '.', 'it', 'is', 'a', 'viewpoint', 'in', 'phuket', 'overlooking', 'the', 'andaman', 'sea', 'and', 'is', 'surrounded', 'by', 'water', 'from', 'sides', '.', 'you', 'can', 'feel', 'the', 'salty', 'breeze', 'some', 'lone', 'cruise', 'on', 'the', 'horizon', 'and', 'obviously', 'the', 'sun', ',', 'touching', 'the', 'line', 'where', 'sea', 'and', 'sky', 'meet', '.', 'you', 'can', 'never', 'forget', 'that', 'experience', '.', 'a', 'must', 'watch']"
A must go place in Phuket! Even during the day the views are breathtaking!,a must go place in phuket even during the day the views are breathtaking,"['a', 'must', 'go', 'place', 'in', 'phuket', 'even', 'during', 'the', 'day', 'the', 'views', 'are', 'breathtaking']"
"The best place to view sunset in Phuket, fantastic place to take pics, keep in mind there are some stairs which you need to climb.","the best place to view sunset in phuket, fantastic place to take pics, keep in mind there are some stairs which you need to climb.","['the', 'best', 'place', 'to', 'view', 'sunset', 'in', 'phuket', ',', 'fantastic', 'place', 'to', 'take', 'pics', ',', 'keep', 'in', 'mind', 'there', 'are', 'some', 'stairs', 'which', 'you', 'need', 'to', 'climb', '.']"
Came here to see the sunset. Nothing special about the sunset. The place was crowded and difficult to get parking spaces. Met few street performers here,came here to see the sunset. nothing special about the sunset. the place was crowded and difficult to get parking spaces. met few street performers here,"['came', 'here', 'to', 'see', 'the', 'sunset', '.', 'nothing', 'special', 'about', 'the', 'sunset', '.', 'the', 'place', 'was', 'crowded', 'and', 'difficult', 'to', 'get', 'parking', 'spaces', '.', 'met', 'few', 'street', 'performers', 'here']"
"Its a beautiful sunset point and a tourist attraction. You can walk around, click pictures and sit for a while as it has various walkways, gardens and places to sit. Don't forget your cameras when you visit here. Carry something to eat and drink while you enjoy the beauty around you!","its a beautiful sunset point and a tourist attraction. you can walk around, click pictures and sit for a while as it has various walkways, gardens and places to sit. do not forget your cameras when you visit here. carry something to eat and drink while you enjoy the beauty around you","['its', 'a', 'beautiful', 'sunset', 'point', 'and', 'a', 'tourist', 'attraction', '.', 'you', 'can', 'walk', 'around', ',', 'click', 'pictures', 'and', 'sit', 'for', 'a', 'while', 'as', 'it', 'has', 'various', 'walkways', ',', 'gardens', 'and', 'places', 'to', 'sit', '.', 'do', 'not', 'forget', 'your', 'cameras', 'when', 'you', 'visit', 'here', '.', 'carry', 'something', 'to', 'eat', 'and', 'drink', 'while', 'you', 'enjoy', 'the', 'beauty', 'around', 'you']"
"Try not to go here during high noon like I did.  This was the most amazing spot in Phuket. I would say must see if you like to take pics. Avoid during high noon, I never was here for sunset but I bet it is incredible.  My pics are unavailable but I imagine there are way better than mine up in previous reviews.","try not to go here during high noon like i did. this was the most amazing spot in phuket. i would say must see if you like to take pics. avoid during high noon, i never was here for sunset but i bet it is incredible. my pics are unavailable but i imagine there are way better than mine up in previous reviews.","['try', 'not', 'to', 'go', 'here', 'during', 'high', 'noon', 'like', 'i', 'did', '.', 'this', 'was', 'the', 'most', 'amazing', 'spot', 'in', 'phuket', '.', 'i', 'would', 'say', 'must', 'see', 'if', 'you', 'like', 'to', 'take', 'pics', '.', 'avoid', 'during', 'high', 'noon', ',', 'i', 'never', 'was', 'here', 'for', 'sunset', 'but', 'i', 'bet', 'it', 'is', 'incredible', '.', 'my', 'pics', 'are', 'unavailable', 'but', 'i', 'imagine', 'there', 'are', 'way', 'better', 'than', 'mine', 'up', 'in', 'previous', 'reviews', '.']"
ts very Nice and very wonderful place. Here u on top very nice view for Sunset. Many tourist coming here for see the sunset. Here u take pictures and make videos coming amazing and very beautiful very nice. Outside around this area very nice view and very neat and clean around there here this place. I like too much this place. Thanks,ts very nice and very wonderful place. here you on top very nice view for sunset. many tourist coming here for see the sunset. here you take pictures and make videos coming amazing and very beautiful very nice. outside around this area very nice view and very neat and clean around there here this place. i like too much this place. thanks,"['ts', 'very', 'nice', 'and', 'very', 'wonderful', 'place', '.', 'here', 'you', 'on', 'top', 'very', 'nice', 'view', 'for', 'sunset', '.', 'many', 'tourist', 'coming', 'here', 'for', 'see', 'the', 'sunset', '.', 'here', 'you', 'take', 'pictures', 'and', 'make', 'videos', 'coming', 'amazing', 'and', 'very', 'beautiful', 'very', 'nice', '.', 'outside', 'around', 'this', 'area', 'very', 'nice', 'view', 'and', 'very', 'neat', 'and', 'clean', 'around', 'there', 'here', 'this', 'place', '.', 'i', 'like', 'too', 'much', 'this', 'place', '.', 'thanks']"
"This is one of the best place in Phuket and a must visit if you are there. It takes about 30 minutes to travel there by car from Patong. The view of the cape from the top is amazing. If you stay until the evening, you may be able to view the beautiful sunset. There are also restaurants and shops in the area. This place is always crowded with tourists. However it is still one of the most romantic place around. If you want to impress your girl, give this a try!","this is of the best place in phuket and a must visit if you are there. it takes about minutes to travel there by car from patong. the view of the cape from the top is amazing. if you stay until the evening, you may be able to view the beautiful sunset. there are also restaurants and shops in the area. this place is always crowded with tourists. however it is still of the most romantic place around. if you want to impress your girl, give this a try","['this', 'is', 'of', 'the', 'best', 'place', 'in', 'phuket', 'and', 'a', 'must', 'visit', 'if', 'you', 'are', 'there', '.', 'it', 'takes', 'about', 'minutes', 'to', 'travel', 'there', 'by', 'car', 'from', 'patong', '.', 'the', 'view', 'of', 'the', 'cape', 'from', 'the', 'top', 'is', 'amazing', '.', 'if', 'you', 'stay', 'until', 'the', 'evening', ',', 'you', 'may', 'be', 'able', 'to', 'view', 'the', 'beautiful', 'sunset', '.', 'there', 'are', 'also', 'restaurants', 'and', 'shops', 'in', 'the', 'area', '.', 'this', 'place', 'is', 'always', 'crowded', 'with', 'tourists', '.', 'however', 'it', 'is', 'still', 'of', 'the', 'most', 'romantic', 'place', 'around', '.', 'if', 'you', 'want', 'to', 'impress', 'your', 'girl', ',', 'give', 'this', 'a', 'try']"
Very nice view at sunset. A perfect spot for a romantic couples picture or even just for viewing it alone. The sunset doesn't last for too long but it's beautiful enough to make you want to see it every day you're in town.,very nice view at sunset. a perfect spot for a romantic couples picture or even just for viewing it alone. the sunset does not last for too long but it is beautiful enough to make you want to see it every day you are in town.,"['very', 'nice', 'view', 'at', 'sunset', '.', 'a', 'perfect', 'spot', 'for', 'a', 'romantic', 'couples', 'picture', 'or', 'even', 'just', 'for', 'viewing', 'it', 'alone', '.', 'the', 'sunset', 'does', 'not', 'last', 'for', 'too', 'long', 'but', 'it', 'is', 'beautiful', 'enough', 'to', 'make', 'you', 'want', 'to', 'see', 'it', 'every', 'day', 'you', 'are', 'in', 'town', '.']"
