raw,clean,clean-default
A beautiful temple with brilliant architecture and paintings. Very peaceful . Has a dress code as it is a holy place .,a beautiful temple with brilliant architecture and paintings very peaceful has a dress code as it is a holy place,"['beautiful', 'temple', 'brilliant', 'architecture', 'painting', 'peaceful', 'dress', 'code', 'holy', 'place']"
Beautiful place. Must visit place in Phuket. We could witness rich culture and glory of Buddhism!!,beautiful place must visit place in phuket we could witness rich culture and glory of buddhism,"['beautiful', 'place', 'visit', 'place', 'phuket', 'witness', 'rich', 'culture', 'glory', 'buddhism']"
"Famous attrations have a lot of overseas visitors and locals,  temples and the pagoda are well maintained and keep tidy. With bare feet walking up both of them and viewing the Buddhas in each level giving you a peaceful mind and recap the beautiful moments of the pass.",famous attrations have a lot of overseas visitors and locals temples and the pagoda are well maintained and keep tidy with bare feet walking up both of them and viewing the buddhas in each level giving you a peaceful mind and recap the beautiful moments of the pass,"['famous', 'attration', 'lot', 'overseas', 'visitor', 'local', 'temple', 'pagoda', 'maintain', 'tidy', 'bare', 'foot', 'walk', 'view', 'buddha', 'level', 'give', 'peaceful', 'mind', 'recap', 'beautiful', 'moment', 'pass']"
"nice and relaxing atmosphere, however its really touristic spot with many tour group, so if you want to go somewhere for a peace of mind this place might not provide that. but if you need to visit a temple with well manage and beautiful scene to take a photo and make a wish in the same place, this place is the answer.",nice and relaxing atmosphere however its really touristic spot with many tour group so if you want to go somewhere for a peace of mind this place might not provide that but if you need to visit a temple with well manage and beautiful scene to take a photo and make a wish in the same place this place is the answer,"['nice', 'relaxing', 'atmosphere', 'touristic', 'spot', 'tour', 'group', 'want', 'peace', 'mind', 'place', 'not', 'provide', 'need', 'visit', 'temple', 'manage', 'beautiful', 'scene', 'photo', 'wish', 'place', 'place', 'answer']"
Chalong Temple is one of the most popular and holy temple in Phuket. Very beautiful temple and surrounded by good nature views. A must to visit place in Thailand.,chalong temple is of the most popular and holy temple in phuket very beautiful temple and surrounded by good nature views a must to visit place in thailand,"['chalong', 'temple', 'popular', 'holy', 'temple', 'phuket', 'beautiful', 'temple', 'surround', 'good', 'nature', 'view', 'visit', 'place', 'thailand']"
Peaceful place to spend some time. It has many small Temples. The architecture of the temples signify the Thai culture. People also perform some rituals in the temples. I wish there was a guide to explain about these temples and their history. Otherwise the place has got some boards explained about the particular place.They have parking place for tourist vehicles.It takes about half an hour to visit all the temples in this place.,peaceful place to spend some time it has many small temples the architecture of the temples signify the thai culture people also perform some rituals in the temples i wish there was a guide to explain about these temples and their history otherwise the place has got some boards explained about the particular place.they have parking place for tourist vehicles.it takes about half an hour to visit all the temples in this place,"['peaceful', 'place', 'spend', 'time', 'small', 'temple', 'architecture', 'temple', 'signify', 'thai', 'culture', 'people', 'perform', 'ritual', 'temple', 'wish', 'guide', 'explain', 'temple', 'history', 'place', 'get', 'board', 'explain', 'particular', 'place.they', 'parking', 'place', 'tourist', 'vehicles.it', 'take', 'half', 'hour', 'visit', 'temple', 'place']"
"Very beautiful and calm place. This place has a history and mythical links to Buddha's life. There are some beliefs about Buddha for which people here have made certain rules, and I request everyone to kindly abide by them. A very peculiar ritual I observed here is that when people's wishes get fulfilled they come back here to burst crackers to show their happiness. The temple complex even has a chimney for this.",very beautiful and calm place this place has a history and mythical links to buddha 's life there are some beliefs about buddha for which people here have made certain rules and i request everyone to kindly abide by them a very peculiar ritual i observed here is that when people 's wishes get fulfilled they come back here to burst crackers to show their happiness the temple complex even has a chimney for this,"['beautiful', 'calm', 'place', 'place', 'history', 'mythical', 'link', 'buddha', 'life', 'belief', 'buddha', 'people', 'certain', 'rule', 'request', 'kindly', 'abide', 'peculiar', 'ritual', 'observe', 'people', 'wish', 'fulfil', 'come', 'burst', 'cracker', 'happiness', 'temple', 'complex', 'chimney']"
Amazing experience with our guide explaining things and showing us what to do at each point in the visit. Would go again as it was abit rushed and I eoukd have liked more time there.,amazing experience with our guide explaining things and showing us what to do at each point in the visit would go again as it was abit rushed and i eoukd have liked more time there,"['amazing', 'experience', 'guide', 'explain', 'thing', 'show', 'point', 'visit', 'abit', 'rush', 'eoukd', 'like', 'time']"
This is my go to place to send off prayers and show gratitude. I love visiting the temples every 2 weeks or so.. never ceases to amaze me.,this is my go to place to send off prayers and show gratitude i love visiting the temples every weeks or so never ceases to amaze me,"['place', 'send', 'prayer', 'gratitude', 'love', 'visit', 'temple', 'week', 'cease', 'amaze']"
Great place to explore local Temple. People should be mindful of their clothing here as it is a religious place,great place to explore local temple people should be mindful of their clothing here as it is a religious place,"['great', 'place', 'explore', 'local', 'temple', 'people', 'mindful', 'clothing', 'religious', 'place']"
"We visited this temple complex as part of our city tour. Its a huge temple complex comprising of a lot of different temples. The architecture is just amazing. U can spend hours just observing the beautiful colors and designs on d temple. We spent about half an hour here, since that was d time alloted by our tour guy.Once u enter d temple, u feel d peace n quietness inside u. Its just so peaceful here. Don't miss out on this visit.",we visited this temple complex as part of our city tour its a huge temple complex comprising of a lot of different temples the architecture is just amazing you can spend hours just observing the beautiful colors and designs on d temple we spent about half an hour here since that was d time alloted by our tour guy.once you enter d temple you feel d peace n quietness inside u. its just so peaceful here do not miss out on this visit,"['visit', 'temple', 'complex', 'city', 'tour', 'huge', 'temple', 'complex', 'comprising', 'lot', 'different', 'temple', 'architecture', 'amazing', 'spend', 'hour', 'observe', 'beautiful', 'color', 'design', 'd', 'temple', 'spend', 'half', 'hour', 'd', 'time', 'allot', 'tour', 'guy.once', 'enter', 'd', 'temple', 'feel', 'd', 'peace', 'n', 'quietness', 'inside', 'u.', 'peaceful', 'not', 'miss', 'visit']"
"Good place to visit ,but there should be proper boarding in English to explain the significance.this was better then bug budha (not so commercial)",good place to visit but there should be proper boarding in english to explain the significance.this was better then bug budha not so commercial,"['good', 'place', 'visit', 'proper', 'boarding', 'english', 'explain', 'significance.this', 'well', 'bug', 'budha', 'not', 'commercial']"
"a peaceful place. there are some temples in one area. there is also a museum with a beautiful ornament and many statues in it. i really amazed with the detail ornament in every corner of the building. the shocked moment was that when a man put a lot firecracker inside of a stack of bricks, and fire it, so i could hear a huge sound from it and that stack is near the temple. i was just wondered, aren't the people disturbed with that sound?",a peaceful place there are some temples in area there is also a museum with a beautiful ornament and many statues in it i really amazed with the detail ornament in every corner of the building the shocked moment was that when a man put a lot firecracker inside of a stack of bricks and fire it so i could hear a huge sound from it and that stack is near the temple i was just wondered am not the people disturbed with that sound,"['peaceful', 'place', 'temple', 'area', 'museum', 'beautiful', 'ornament', 'statue', 'amazed', 'detail', 'ornament', 'corner', 'building', 'shocked', 'moment', 'man', 'lot', 'firecracker', 'inside', 'stack', 'brick', 'fire', 'hear', 'huge', 'sound', 'stack', 'near', 'temple', 'wonder', 'not', 'people', 'disturb', 'sound']"
"Amazing tample to loose yourself for couple of hours, admiring the architecture and the importance that locals give to it.",amazing tample to loose yourself for couple of hours admiring the architecture and the importance that locals give to it,"['amazing', 'tample', 'loose', 'couple', 'hour', 'admire', 'architecture', 'importance', 'local']"
Nice Peaceful Temple and surrounding areas. Various other temples around too. In the main temple there are beautiful paintings that tell stories.,nice peaceful temple and surrounding areas various other temples around too in the main temple there are beautiful paintings that tell stories,"['nice', 'peaceful', 'temple', 'surround', 'area', 'temple', 'main', 'temple', 'beautiful', 'painting', 'tell', 'story']"
